"id","blog","category","markdown"
16239,"WN623","Software","Lilly Tinzmann [reported](https://heigit.org/recent-feature-additions-to-ohsome-quality-analyst/) that there have been features added to the [Ohsome Quality Analyst](https://oqt.ohsome.org/), a data quality analysis tool for OSM accessible via a web interface. The new features include the ability to retrieve HTML snippets with a visual representation of the indicator results and expanded data input options."
16278,"WN625","Mapping","Sarah Heidekorn [presented](https://heigit.org/ohsome-region-of-the-month-hiking-related-tags-mountains/) a new entry in the [ohsome Region of the Month](http://k1z.blog.uni-heidelberg.de/?s=%22region+of+the+month%22) series, a blog with many helpful guides for OSM mapping. This month is part two about hiking tags and explains the connection between said tags and user activity by using insights from [the first post](https://heigit.org/ohsome-region-of-the-month-back-on-trail/) in the series."
16345,"WN628","OSM research","Mohammed Rizwan Khan [reported](https://heigit.org/ohsomehex-lite-mode-mobile-friendly-ohsomehex/) on the development of a lite-mode ohsomeHeX [application](https://hex.ohsome.org/#/amenity_clinic_healthcare_clinic_ptpl/2022-05-01T00:00:00Z/2/0/0) for smaller-screen mobile devices. Though the application will have limited functionality on smaller screens, it will still allow mobile users to get an overview of current OSM topics on the go."
16414,"WN630","Software","Sarah Heidekorn [discussed](https://heigit.org/an-ohsome-way-to-check-if-osm-is-up-to-date/) '[is-osm-uptodate](https://is-osm-uptodate.frafra.eu/#17/45.46423/9.19073)', an application that uses the [ohsome API](https://docs.ohsome.org/ohsome-api/v1/) as a back-end to accumulate historical OSM data, in the newest entry of the 'How to become ohsome' [series](https://heigit.org/tag/become-ohsome/) of articles. As the name suggests, this application allows users to check if the OSM data within their given input boundary is up to date."
16436,"WN631","Software","Sarah Heidekorn [presented](https://heigit.org/how-to-become-ohsome-part-14-advanced-dashboarding/) the 14th entry to the '[How to become ohsome?](https://heigit.org/tag/become-ohsome/)' series, discussing the convenient and intuitive [ohsome dashboard](https://ohsome.org/apps/dashboard/). Boasting more of a user interface than other tools, the ohsome dashboard allows users to select features of interest using a map. A recent update with advanced filter settings now also provides more complex filters."
16585,"WN635","Software","[HeiGIT](https://heigit.org/), the Heidelberg Institute for Geoinformation Technology, [reported](https://heigit.org/new-feature-addition-to-ohsome-quality-analyst-building-completeness-indicator/) that a building completeness indicator has been added to the [ohsome quality analyst](https://oqt.ohsome.org/). This indicator uses proxy variables to predict the expected area of buildings in a given area of interest and then compares this prediction to the total area of buildings currently mapped in OSM."
16596,"WN636","Picture","![lead picture](https://weeklyosm.eu/wp-content/uploads/2022/09/636_T_all.jpg =812x335)

Integration of the Ohsome Quality Analyst in ohsomeHeX [[^1^](#wn636_27417)]  | ©  [HeiGIT](https://heigit.org/) | © Map tiles bei [Stamen Design](https://stamen.com/) | map data  © [OpenStreetMap contributors](https://wiki.osmfoundation.org/wiki/Licence/Licence_and_Legal_FAQ)"
16608,"WN636","Software","[1] Rizwan Khan [reported](https://heigit.org/ohsomehex-with-quality-indication-from-oqt/) that HeiGIT has begun to integrate some of the functionality of the [Ohsome Quality Analyst](https://oqt.ohsome.org/) into [ohsomeHeX](https://hex.ohsome.org/#/amenity_clinic_healthcare_clinic_ptpl/2022-08-01T00:00:00Z/2/0/0), a tool to visualise maps and time series of data development in OSM. A completeness indicator for mapping saturation now allows the estimation of completeness by looking at the saturation of the data."
16793,"WN641","Programming","Sarah Heidekorn from HeiGIT [reports](https://heigit.org/de/near-realtime-openstreetmap-data-and-stats-oshdb-and-ohsome-api-are-now-updated-hourly-2/) that the [OSHDB](https://github.com/GIScience/oshdb) and [ohsome API](https://github.com/GIScience/ohsome-api) are now updated hourly. The OSHDB allows users to investigate the evolution of the amount of data and contributions to OSM, while the ohsome API is a generic web API for in-depth analysis of OpenStreetMap (OSM) data with a focus on its history."
16795,"WN641","Programming","Sarah Heidekorn, from HeiGIT, [presented](https://heigit.org/ohsome-region-of-the-month-temporal-osm-developments-in-kyiv/) the latest chapter in the ohsome region of the month series. This time, they're looking at the temporal development of highways and how to add smoothness information, as well as social facilities and updates on map development for Kyiv."
16948,"WN645","Programming","The Heidelberg Institute for Geoinformation Technology [reported](https://heigit.org/oshdb-version-1-0-has-arrived/) that version 1.0 of their [OSHDB](https://github.com/GIScience/oshdb) has been released. The OSHDB is an OpenStreetMap history database that allows users to visualise and explore the amount of data and contributions to OSM over time in a user-friendly manner via the [ohsome dashboard](https://ohsome.org/apps/dashboard/)."
16961,"WN646","Programming","rtnf [explained](https://www.openstreetmap.org/user/rtnf/diary/400461) how he used Python and the [ohsome dashboard interface](https://ohsome.org/apps/dashboard/) to dive into the OSM mapping history in his area."
17231,"WN653","OSM research","With the [release](https://heigit.org/oshdb-version-1-0-has-arrived/) of the [OSHDB](https://github.com/GIScience/oshdb)  (OpenStreetMap History Database) Version 1 for spatio-temporal analysis, the HeiGIT team at [Heidelberg University](https://heigit.org/) has reached an important milestone. The data is  open to everyone, whether they belong to journalism, science or humanitarian organisations. The ohsome [dashboard](https://ohsome.org/apps/dashboard/) allows you to analyse OSM temporal data for any region. A significant enhancement is the new OSHDB filters that allow practitioners to filter entities by the shape of the geometry (one measure of quality often discussed by the OSM community)."
17473,"WN660","OSM research","HeiGIT [announced](https://heigit.org/an-ohsome-r-package-on-cran/) that its ohsome R package has finally landed on [CRAN](https://cran.r-project.org/web/packages/ohsome/index.html). This makes it easier to analyse the rich data source of OSM history using R. You can specify your own temporal, spatial and/or thematic filters and request aggregated statistics on the evolution of OSM elements. The package can now be installed directly from CRAN."
17510,"WN661","OSM research","HeiGIT [presented](https://heigit.org/de/heigit-to-hold-hands-on-workshop-about-osm-data-quality-at-fossgis-berlin-15-18-03-2023-3/) :DE-s: its [ohsome quality analyst (OQT)](https://oqt.ohsome.org/) software at the FOSSGIS conference in Berlin. This tool is used to analyse OSM data and see how it changes over time."
17558,"WN662","Events","The team at GIScience and HeiGIT [looked](https://heigit.org/heigit-and-giscience-contributions-to-last-years-conference-athon/) back and commented on the many contributions made at last year’s conferences. For example, HeiGIT's Big Spatial Data Analytics team led the [Saturday workshop](https://2022.stateofthemap.org/sessions/R7GW3X/) with 'Analysing changes in OSM over time – full history access to OSM data through the ohsome framework'. Moritz Schott held a [talk](https://talks.osgeo.org/foss4g-2022-academic-track/talk/MCGBBT/) at FOSS4G presenting [OSM element vectorisation](https://gitlab.gistools.geog.uni-heidelberg.de/giscience/ideal-vgi/osm-element-vectorisation) and much more."
17824,"WN671","Programming","HeiGIT, in part 15 of the ohsome series, [analysed](https://heigit.org/how-to-become-ohsome-pat-15-analysing-changes-in-osm-after-the-earthquake-in-syria-and-turkiye-in-february-2023/) the mapping done in OSM after the earthquakes in Syria and Turkey in February 2023, using three different approaches. The results showed the amount of data contributed in OSM following the earthquake as well as which regions experienced the most intensive mapping activity."
18083,"WN678","Other Geo Things","HeiGIT [announces](https://heigit.org/integration-of-oqt-into-the-ohsome-dashboard-computing-data-quality-metrics-for-openstreetmap-2/) that the [ohsome dashboard](https://dashboard.ohsome.org/) got extended to be able to compute data quality metrics for OpenStreetMap through the [ohsome quality analyst (OQT)](https://heigit.org/big-spatial-data-analytics-en/ohsome/ohsome-quality-analyst-oqt/) which is also developed by HeiGIT."
18075,"WN678","Software","Jochen Topf, the developer of Taginfo, [describes](https://blog.jochentopf.com/2023-07-15-linking-to-external-tools-from-taginfo.html) the external links he has added to Taginfo's Tags pages with instructions on how to extract / analyze them from external tools (Overpass, OSM Tag History, and ohsome).  ohsome gives the option to select countries to analyze historical OSM data."
18178,"WN682","Education","The Heidelberg Institute for Geoinformation Technology has [provided](https://heigit.org/visualizing-oqt-api-results-in-qgis/) a guide on how to visualise [ohsome quality analyst](https://heigit.org/big-spatial-data-analytics-en/ohsome/ohsome-quality-analyst-oqt/) API results in QGIS using the [ohsome dashboard](https://dashboard.ohsome.org/)."
18173,"WN682","OSM research","The Big Spatial Data Analytics team at HeiGIT has [developed](https://heigit.org/introducing-ohsomenow-stats-real-time-monitoring-for-openstreetmap-contributions/), in cooperation with the Humanitarian OSM Team ([HOT](https://www.hotosm.org/)), a new dashboard for monitoring contributions to OSM in real time called [ohsomeNow stats](https://stats.now.ohsome.org/dashboard#hashtags=covid19&start=2020-07-01T10:00:00.000Z&end=2021-07-01T10:00:00.000Z&interval=P1D). The dashboard replaces the Missing Maps Leaderboard and provides a comprehensive overview of how much mapping took place at certain mapping events and campaigns."
18314,"WN686","Releases","HeiGIT [reported](https://heigit.org/version-1-0-of-the-ohsome-quality-api-and-ohsome-dashboard/) that version 1.0 of their [ohsome quality API](https://api.quality.ohsome.org/v1/docs) and [ohsome dashboard](https://dashboard.ohsome.org/) is now online. The new version includes an overhauled  [currentness indicator](https://dashboard.ohsome.org/#backend"
18338,"WN686","Releases","HeiGIT [reported](https://heigit.org/taginfo-goes-ohsome/) that the ohsome dashboard has now been integrated with taginfo."
18639,"WN695","Maps","Juan Jose Iglesias [reported](https://t.me/OpenStreetMapOrg/111642) that the OpenStreetMap Analytics service ([osm-analytics.org](https://osm-analytics.org)) will soon be shut down. Users are advised to switch to a similar [alternative service](https://dashboard.ohsome.org) managed by HeiGIT."
19464,"WN714","Releases","The Heidelberg Institute for Geoinformation Technology [launched](https://mapstodon.space/@heigit/112139715306585567) version 1.0 of their ohsomeNow stats dashboard, [developed](https://heigit.org/introducing-ohsomenow-stats-v1-0/) in cooperation with the Humanitarian OpenStreetMap Team (we [reported](https://weeklyosm.eu/archives/16658#wn682_28969) earlier), for monitoring contributions to OpenStreetMap  in real-time. Version 1.0 [features](https://www.youtube.com/watch?v=hvu5L_4_wsQ) new functionality including OSM Data Topics display, a live mode for mapathons, hashtag search, data download options, and user-specific time zones for enhanced mapping event and campaign tracking."
19823,"WN722","Software","Enhance your OSM data analysis with the new features of the [ohsome Dashboard](https://dashboard.ohsome.org/), which now includes dataset comparison and mapping saturation evaluation. Learn more through the detailed blog [post](https://heigit.org/ohsome-quality-api-new-features-2/) and an explanatory [video](https://youtu.be/y3QM7C5D2p4?si=u9PkUb5yrQjKasox)."
19877,"WN723","Software","Dominik Neumann [highlighted](https://giscienceblog.uni-heidelberg.de/2024/05/22/ohsome-quality-api-new-features/) some of the new features of the ohsome Quality API, including comparative analysis with external datasets, an intuitive interface for seamless data quality assessment, flexible region selection, comprehensive results display, and real-time sharing, all based on open source technology to enhance OpenStreetMap data analysis."
20350,"WN734","Releases","Version 1.2.3 of OSHDB has been [released](https://github.com/GIScience/oshdb/releases/tag/1.2.3) and there is a tutorial, 'First Steps using the OSHDB-API',  [available](https://github.com/GIScience/oshdb/tree/main/documentation/first-steps) on GitHub. OSHDB is a high-performance framework for spatio-temporal data analysis of OpenStreetMap's full-history data, developed by HeiGIT, as part of the ohsome project."
20615,"WN740","OSM research","HeiGIT [reported](https://heigit.org/quality-assessment-for-world-bank-geest-methodology-2/) that they have conducted a data quality assessment of open source data (including OSM) [using](https://heigit.org/de/big-spatial-data-analytics/ohsome-3/ohsome-quality-api/) their ohsome quality API. They analyzed aspects such as currentness, completeness, comparison with external datasets, and the activity of OSM contributors. The results of the analysis were to support the efforts of the World Bank to [develop](https://blogs.worldbank.org/en/opendata/introducing-geest-innovative-tool-links-women-jobs-through-geographic-insights) an analytical tool, the Gender Enabling Environments Spatial Tool, designed to assess localities based on how supportive they are in enabling women to access employment or business opportunities in the renewable energy sector."
20754,"WN744","Releases","HeiGIT [announced](https://heigit.org/new-features-for-the-ohsome-quality-api-and-dashboard/) new features for the ohsome Quality API and Dashboard, expanding its data quality assessment tools. Previously, it had used three indicators: data currentness, mapping saturation, and a building and road comparison with reference data. The latest update introduced a fourth indicator, attribute completeness, which shows the percentage of features in an area with specific additional attributes."
21262,"WN755","Community","Ciarán Staunton has [analysed](https://www.openstreetmap.org/user/DeBigC/diary/405923) the current progress of the Ireland OSM community's #osmIRL_buildings mapping project using the ohsome Dashboard."
21320,"WN756","Software","The [ohsome-py](https://gitlab.heigit.org/giscience/big-data/ohsome/ohsome-api-analysis-examples/ohsome-py-0.4.0-blogpost) Python package is a client for the ohsome API, designed to facilitate the extraction and analysis of historical OpenStreetMap data. The package [simplifies](https://heigit.org/de/ohsome-py-0-4.0/)  handling ohsome API requests and responses by converting them into pandas or GeoPandas data frames, making data analysis and visualisation easier."
21335,"WN757","Software","HeiGIT [tooted](https://mapstodon.space/@heigit/113866403155491795) some metrics, made using ohsome, about contributions made to OpenStreetMap in 2024, describing the scale of OSM use and demonstrating the analytical capabilities of ohsome."
21388,"WN758","OSM research","HeiGIT has [developed](https://mapstodon.space/@heigit/113878240408856902) a pipeline to [evaluate](https://heigit.org/osm-completeness-with-overture-maps-data/) the completeness of OSM building data by [comparing](https://giscience.github.io/sotm-2024-ohsome-data-insights-workshop/book/06_Completeness_of_OSM_building_data.html) it to the Overture Maps database."
21417,"WN759","Software","HeiGIT has recently [expanded](https://heigit.org/ohsome-quality-api-enhancements-for-the-attribute-completeness-indicator/
) the ohsome Quality API and its [dashboard](https://dashboard.ohsome.org/), adding a new indicator to assess attribute completeness in OpenStreetMap and introducing major upgrades to the functionalities of this Indicator:
  Multi-Attribute Queries: Assess the completeness of multiple attributes simultaneously, such as comprehensive address information.
  Custom Attribute Filters: Define complex key-value combinations using and/or logic for more advanced data analysis.

The code is [available](https://github.com/GIScience/ohsome-quality-api) on GitHub."
21637,"WN765","OSM research","HeiGIT [reported](https://heigit.org/new-paper-ai-generated-buildings-in-openstreetmap-frequency-of-use-and-differences-from-non-ai-generated-buildings/) that Milan Fila and others have [published](https://www.tandfonline.com/doi/full/10.1080/17538947.2025.2473637) a paper on AI-generated buildings in OpenStreetMap. This study explored the impact of AI-generated data in OSM, addressing key research questions related to data identification, distribution, quality, and modifications over time using the ohsome [API](https://docs.ohsome.org/ohsome-api/v1/) and OpenStreetMap History Database ([OSHDB](https://github.com/GIScience/oshdb))."
21677,"WN766","Software","[ohsome-planet](https://github.com/GIScience/ohsome-planet/releases/tag/1.0.0) is a new software library, available on GitHub, that [facilitates](https://heigit.org/first-release-of-ohsome-planet-osm-history-data-in-geoparquet-format-2)  the transformation of raw OpenStreetMap history data into the GeoParquet format, making it more accessible and efficient for spatial data analysis. With ohsome-planet, HeiGIT is making a big step toward the development of ohsome 2.0."
