"id","blog","category","markdown"
6433,"WN397","Programming","The geodata analysis team of [HeiGIT](http://www.geog.uni-heidelberg.de/gis/heigit_en.html) [is currently developing](http://gisuser.com/2018/02/introducing-the-ohsome-osm-history-analytics-platform/) a historical OpenStreetMap analysis platform. The goal is to make OSM data from the past more readily available for various types of data analysis tasks at the global level."
6603,"WN400","Software","A history analysis platform for OpenStreetMap is currently being developed at HeiGIT. It will make OSM data from the full history of edits more easily accessible. Check out the [project](http://k1z.blog.uni-heidelberg.de/2018/03/15/preview-of-the-ohsome-nepal-dashboard/)'s  first [ohsome Nepal Dashboard preview](https://ohsome.org/apps/kll-dashboard-preview/)."
6844,"WN406","Software","Heidelberg GIScience provided the first working example of the [forthcoming REST-based ""Ohsome API""](http://giscienceblog.uni-hd.de/2018/04/26/the-ohsome-api-dynamic-osm-statistics-for-real-world-applications/) for easy-to-use full history analytics of OSM."
7019,"WN410","Programming","Rafael Troilo from HeiGIT [gives](http://giscienceblog.uni-hd.de/2018/05/18/ohsome-a-high-level-architectual-overview-of-the-osm-history-analytics-platform) a short overview of the access layers of the OSM History Analytics platform `ohsome` with the new OSM History Database OSHDB."
7070,"WN411","Software","HeiGIT demonstrated how to use the OSM History Analytics platform ohsome for OSM Street Network Topology Analysis and Disaster Activation Monitoring [ISCRAM paper](http://giscienceblog.uni-hd.de/2018/05/29/ohsome-for-street-network-analysis-and-disaster-activation-monitoring/)."
7693,"WN424","Programming","Fabian Kowatsch from the Heidelberg Institute for Geoinformation Technology ([HeiGIT](https://heigit.org)) [published](http://giscienceblog.uni-hd.de/2018/09/03/documentation-of-the-ohsome-api/) a first draft of the documentation of the ohsome API, which is a REST API for analysing the history of OSM data through the OSM History Analytics platform Ohsome.org."
7769,"WN425","Programming","Sabrina Marx, from the Heidelberg Institute for Geoinformation Technology ([HeiGIT](http://heigit.org)), [published](http://giscienceblog.uni-hd.de/2018/09/05/analyse-hot-tasking-manager-projects-with-the-ohsome-api) a step by step tutorial in a [Jupyter Notebook](https://heigit.org/analyse-hot-tasking-manager-projects-with-the-ohsome-api/) on analysing  HOT Tasking Manager projects using the [ohsome API](http://api.ohsome.org/v0.9/swagger-ui.html)."
7979,"WN430","Software","Fabian Kowatsch [introduces a new ohsome dashboard](http://giscienceblog.uni-hd.de/2018/10/10/explore-the-ohsome-osm-history-of-whole-germany) prototype as a preview on what is possible with the HeiGIT's ohsome OpenStreetMap history analytics platform which is deployed on a distributed cloud system using Apache Ignite. You can explore the evolution of any available OSM tag over time in arbitrary areas of Germany and calculate some summary statistics."
8395,"WN439","Software","Fabian Kowatsch from Heidelberg Institute for Geoinformation Technology [explains](http://giscienceblog.uni-hd.de/2018/12/14/how-to-become-ohsome-part-1-visualizing-the-historical-evolution-of-osm-buildings-of-your-city/) how to visualize the historical evolution of OSM buildings of your city using the [ohsome](http://giscienceblog.uni-hd.de/2018/02/22/introducing-the-ohsome-osm-history-analytics-platform/) platform for OSM History Analytics and QGIS."
8603,"WN444","Software","Fabian Kowatsch, from HeiGIT, [explains](http://k1z.blog.uni-heidelberg.de/2019/01/18/how-to-become-ohsome-part-2-comparing-different-regions-based-on-their-attributive-completeness-of-osm-data/) how to use historical OSM data from the ohsome API to compare different regions based on their attribute completeness over time with a simple API call. He uses the tag surface= . for streets as an example."
8764,"WN447","Maps","Martin Raifer [reports](http://giscienceblog.uni-hd.de/2019/02/08/the-future-of-openmapsurfers-tiles/) that the global _OpenMapSurfer_ map tiles by GIScience Heidelberg have been moved to the university cloud and are now available via the [openrouteservice API](https://openrouteservice.org/dev/#/api-docs/mapsurfer). 
They also offer further OSM maps like [osm-wms.de](http://osm-wms.de), [histosm.org](http://histosm.org/), the ohsome [osmatrix](https://heigit.org/big-spatial-data-analytics-en/ohsome/), [osmlanduse.org](http://osmlanduse.org) and the [climate protection map](https://klimaschutzkarte.de/)."
8799,"WN447","Other Geo Things","Melanie Eckle, from the Heidelberg Institute for Geoinformation Technology (HeiGIT), [shared](http://k1z.blog.uni-heidelberg.de/2019/02/10/heigit-at-german-red-cross-digitalisation-in-civil-protection-congress/) her experience at the Red Cross congress  “Digital in civil protection” congress, where she and her colleague presented information about [Missing Maps](http://www.missingmaps.org/) and related work of the GIScience/HeiGIT team, including [openrouteservice for disaster management](https://disaster.openrouteservice.org/) and [ohsome](https://heigit.org/big-spatial-data-analytics-en/ohsome/), the OpenStreetMap History Data Analytics Platform."
8839,"WN448","Maps","Lukas Loos, from HeiGIT, [introduced](http://giscienceblog.uni-hd.de/2019/02/18/openstreetmap-history-explorer-ohsomehex/) a first beta version of the [OpenStreetMap History eXplorer](https://ohsome.org/apps/osm-history-explorer/) (_ohsomeHeX_). It uses [ohsome](https://heigit.org/big-spatial-data-analytics-en/ohsome/) (OpenStreetMap History Data Analytics Platform) to aggregate OSM data of a first set of selected features into a set of world-spanning hexagonal grids in a configurable temporal resolution. The goal is to allow the exploration of the history of OpenStreetMap data in time and space at varying scales. Further improvements are in the pipeline."
8949,"WN450","Other Geo Things","Clemens Jacobs [has been looking](http://giscienceblog.uni-hd.de/2019/02/27/plausible-parrots-heigits-oshdb-supports-research-in-citizen-science-data-quality/) into the data quality of citizen science observations of organisms. This research aims at using geographic context as an information source for estimating the plausibility of an observation, e.g. of a bird, which was reported to a citizen science portal collecting such data from volunteers. To this end, approaches were developed which use OpenStreetMap to capture the geographic context. He used the [ohsome](https://heigit.org/big-spatial-data-analytics-en/ohsome/), OpenStreetMap History Analytics platform by HeiGIT, to predict the plausibility of a new observation of a species."
9018,"WN452","Software","Fabian Kowatsch, of HeiGIT, [announced](http://giscienceblog.uni-hd.de/2019/03/13/global-analyses-are-ohsome/) that the HeiGIT Big Spatial Data team published a public world-wide instance of the _ohsome OSM History Analysis Platform_ including an API, an updated dashboard and the beta prototype map interface _ohsomeHEX (OSM History Explorer)_. All this allows you to analyse the evolution of any OSM tag for arbitrary regions and time periods in a simple way. Several examples are given in earlier blogs which now can be adapted for arbitrary regions around the world. Ideas for further enhancements are most welcome."
9384,"WN459","Software","Fabina Kowatsch has [published](http://k1z.blog.uni-heidelberg.de/2019/05/06/how-to-become-ohsome-part-5-measuring-numbers-of-users-editing-different-osm-features/) the fifth part of the blog series ""[How to become ohsome](http://k1z.blog.uni-heidelberg.de/tag/ohsome-example/)""."
10024,"WN473","Software","Fabian, from HeiGIT, [shows](http://giscienceblog.uni-hd.de/2019/07/05/farm-shops-are-ohsome/) another analytics example using the [ohsome API](http://k1z.blog.uni-heidelberg.de/2018/04/26/the-ohsome-api-dynamic-osm-statistics-for-real-world-applications/) ([http://api.ohsome.org/](http://api.ohsome.org/)). The analysis was inspired by the [global OSM climate protection map](https://klimaschutzkarte.de/)."
10154,"WN476","Events","Lukas and Fabian, from HeiGIT, [presented](http://giscienceblog.uni-hd.de/2019/08/26/heigit-at-foss4g/) a 90 minute lab about analysing OpenStreetMap data history with the [ohsome](https://heigit.org/big-spatial-data-analytics-en/ohsome/) platform at the FOSS4G 2019 conference in Bucharest. The [teaching material and code](https://gitlab.gistools.geog.uni-heidelberg.de/snippets/23) has been [made available](http://giscienceblog.uni-hd.de/2019/09/03/recap-of-heigit-foss4g-2019/) as linked snippets in the GIScience HD Gitlab."
10744,"WN489","Humanitarian OSM","Missing Maps is five years old. A number of blog posts celebrate this event. [Missing Maps themselves](https://www.missingmaps.org/blog/2019/11/27/happy-birthday/) summarise some of the highlights of the past five years and announce, for next year, monthly postings on their blog. Melanie Eckle also [offers](http://k1z.blog.uni-heidelberg.de/2019/12/02/5-years-missing-maps-achievements-and-furture-work-and-how-to-vizualize-the-missing-maps-impact-using-ohsome/) congratulations."
10736,"WN489","Programming","Fabian Kowatsch [described](http://k1z.blog.uni-heidelberg.de/2019/11/28/becoming-ohsome-is-simple-adding-support-of-simple-feature-types-to-the-ohsome-api) some new features of the [""ohsome"" platform](https://heigit.org/big-spatial-data-analytics-en/ohsome/)."
11660,"WN509","Maps","Heidelberg University’s GIScience Research Group [published](http://k1z.blog.uni-heidelberg.de/2020/04/17/osm-completeness-of-health-facilities-in-sub-sahara-africa/) an article about a visualisation of the completeness, in OSM, of health facilities in Sub-Saharan Africa made with its OSM History Explorer ohsomeHEX."
11859,"WN513","Releases","HeiGIT, the Heidelberg University’s GIScience Research Group, [announced](http://k1z.blog.uni-heidelberg.de/2020/05/15/announcing-release-10-of-ohsome-api/) the release of version 1.0 of its [API](https://api.ohsome.org/v0.9/swagger-ui.html) for the history analysis platform for OpenStreetMap called [_ohsome_](https://heigit.org/big-spatial-data-analytics-en/ohsome/). The ohsome project aims to make OSM data from the full history of edits more easily accessible."
12102,"WN518","Releases","The API for the OpenStreetMap history analysis platform, which has been developed by Heidelberg University’s GIScience Research Group, [has reached](http://k1z.blog.uni-heidelberg.de/2020/06/19/ohsome-api-10-is-here/) version 1.0."
12130,"WN519","Software","The Heidelberg University’s GIScience Research Group [announced](http://k1z.blog.uni-heidelberg.de/2020/06/29/sphinx-is-ohsome-new-documentation-of-the-ohsome-api/) that [documentation](https://docs.ohsome.org/ohsome-api/stable/index.html) for version 1.0 of the ohsome API has been released."
12216,"WN521","Mapping","Fabian Kowatsch [introduced](http://k1z.blog.uni-heidelberg.de/2020/07/09/how-to-become-ohsome-part-6-introducing-the-magical-filter-parameter/) the new [filter](https://docs.ohsome.org/ohsome-api/stable/filter.html) parameter available in the OpenStreetMap History Data Analytics Platform (ohsome)."
12367,"WN524","Programming","Fabian, from HeiGIT, [explained](http://k1z.blog.uni-heidelberg.de/2020/07/23/new-function-in-the-ohsome-api-for-checking-query-parameters/) the new function in the ohsome (OSM history Analytics) API for checking query parameters. The API now uses a fuzzy string matcher to suggest which parameter you meant to pass when it encounters one it doesn't recognise in your query."
12369,"WN524","Programming","GIScience Heidelberg [open-sourced](http://k1z.blog.uni-heidelberg.de/2020/07/20/introducing-ohsome2label-tool-to-generate-training-samples-from-openstreetmap-for-geospatial-deep-learning/) the ohsome2label tool, which offers a flexible framework for labelling customised geospatial objects using historical OSM data allowing more effective and efficient deep learning. Based on the [ohsome API](https://ohsome.org) developed by HeiGIT gGmbH, ohsome2label aims to mitigate the lack of abundant high-quality training samples in geospatial deep learning by automatically extracting customised OSM historical features, and providing intrinsic OSM data quality measurements."
12683,"WN530","Releases","Fabian Kowatsch [reported](http://k1z.blog.uni-heidelberg.de/2020/09/14/ohsome-api-v11-changes-and-new-functionalities/) on changes and new functions in the [ohsome](https://docs.ohsome.org/ohsome-api/v1/) API on the [GIScience News Blog](http://giscienceblog.uni-hd.de/)."
12688,"WN530","Software","[1] Marcel Reinmuth, from [HeiGIT](https://heigit.org/de/willkommen/) in Heidelberg, drew [attention](http://k1z.blog.uni-heidelberg.de/2020/09/10/the-future-of-working-with-osm-data/), in a blog post, to a decision tree that helps you choose which of the various tools from ohsome suits your needs. The flowchart can be [downloaded](http://k1z.blog.uni-heidelberg.de/files/2020/09/osmtoolsdecisiontree.pdf) as a PDF."
12817,"WN533","Software","Katharina Przybill [showed](http://k1z.blog.uni-heidelberg.de/2020/10/02/how-to-become-ohsome-part-8-complex-analysis-with-the-magical-filter-parameter/) how to carry out complex analyses using ohsome's magical filter parameter by investigating Heidelberg's cycling infrastructure."
13107,"WN540","Software","HeiGIT has [extended](http://k1z.blog.uni-heidelberg.de/2020/11/11/osm-history-analysis-with-ohsomehex-v10/) their [OSM history explorer](https://ohsome.org/apps/osm-history-explorer) with new features."
13144,"WN541","Community","Alexander Zipf [analysed](http://k1z.blog.uni-heidelberg.de/2020/11/23/exploring-localness-of-osm-data-an-analysis-using-the-oshdb-and-ohsome-api/) how much local information is captured in OpenStreetMap data, which can be an indicator of data quality. In addition to the blogpost a Jupyter Notebook is [available](https://nbviewer.jupyter.org/urls/gitlab.gistools.geog.uni-heidelberg.de/giscience/big-data/ohsome/ohsome-api-analysis-examples/exploring-localness-blogpost/-/raw/master/Exploring%20Localness_Blogpost.ipynb) to generate an interactive map and plots for regions of your choice."
13466,"WN548","Other Geo Things","Sarah (Heidelberg University) has been [investigating](http://k1z.blog.uni-heidelberg.de/2021/01/18/ohsome-street-network-analysis-part-1/) street networks and their quality, in order to find out which of the selected regions has the most detailed information in OpenStreetMap, as well as the best data consistency over the past 10 years."
13574,"WN550","Other Geo Things","Fabian Kowatsch [continued](http://k1z.blog.uni-heidelberg.de/2021/01/31/ohsome-street-network-analysis-part-2/) the series of blog posts on using ohsome to analyse street networks (we [reported](https://weeklyosm.eu/archives/14200#wn548_24217) part one earlier). This week they are looking at the length ratio between streets that have the `maxspeed` tag added and those that do not."
13605,"WN551","Software","The GIScience News Blog [introduced](http://k1z.blog.uni-heidelberg.de/2021/02/08/introducing-the-ohsome-quality-analyst-oqt/) a new tool based on ohsome. The preliminary results presented by the [ohsome Quality AnalysT (OQT)](https://oqt.ohsome.org/) website are about the completeness of mapping in a region (i.e. low level of buildings count vs population and the density of points of interest)."
13764,"WN554","Maps","The latest post from HeiGIT  [looks](http://k1z.blog.uni-heidelberg.de/2021/02/24/an-ohsome-railway-network-visualization-and-analysis/) at the completeness of OpenStreetMap railway network data for a specific city, Prague, and its development over time. Furthermore, the article animates the development of the railway network mapping with instructions so you can learn how to make one yourself."
13816,"WN555","Other Geo Things","Carolin Klonner, and others from GIScience Heidelberg, have [published](http://giscienceblog.uni-hd.de/2021/03/04/new-paper-published-about-the-sketch-map-tool/) a paper about the OSM Sketch Map Tool. This supports participatory mapping approaches and risk communication using and extending OSM Field Papers. It also includes a fitness-for-purpose analysis of the OpenStreetMap data for the respective region, similar to the approach in the [ohsome Quality analysT](http://k1z.blog.uni-heidelberg.de/2021/02/08/introducing-the-ohsome-quality-analyst-oqt/) (OQT) tool."
13973,"WN559","OSM research","GIScienceHD has [presented](http://k1z.blog.uni-heidelberg.de/2021/04/01/ohsome-py-python-package-for-osm-history-analytics-published/) the first version of the ohsome-py Python package. ohsome-py helps you extract and analyse OpenStreetMap history data using the ohsome API and Python. It handles queries to the ohsome API and converts its responses to Pandas or GeoPandas data frames to facilitate easy data handling and analysis. The project is still in an early stage, so there might be changes to the package in the future. To learn how ohsome-py works [get started](https://github.com/GIScience/ohsome-py/blob/development/notebooks/Tutorial.ipynb) with the tutorial."
14073,"WN562","Programming","MapAction and HeiGIT are [working together](http://k1z.blog.uni-heidelberg.de/2021/04/21/mapaction-and-heigit-partner-to-further-geoinformation-innovation/) to carry out further research and development, teaching, outreach, and fundraising to support humanitarian mapping. Projects currently being planned include OSM analytics such as [Humanitarian OSM Stats](https://humstats.heigit.org/), and OSM data-quality assessments and improvements such as the [ohsome quality analyst](https://oqt.ohsome.org/index.html)."
14223,"WN566","Maps","Mohammed Rizwan Khan [described](http://k1z.blog.uni-heidelberg.de/2021/05/17/ohsomehex-provides-access-to-osm-feature-history/) how ohsomeHex can show how your city was mapped over time, how geometries were changed and refined, and how mistakes were added and corrected again. ohsomeHex has a great new feature &mdash; the individual object’s zoom-in-history-view."
14291,"WN568","OSM research","Jan Pisl, Hao Li, and others are [proposing](http://k1z.blog.uni-heidelberg.de/2021/05/12/detecting-openstreetmap-missing-buildings-by-transferring-pre-trained-deep-neural-networks/) a method of transferring a building detection model, which was previously trained in an area well-mapped in OSM, to remote data-scarce areas. The proposed model can detect individual buildings by generating bounding boxes around each of them which leads to a significant improvement in the [f1-score](https://en.wikipedia.org/wiki/F-score). They have also [presented](http://k1z.blog.uni-heidelberg.de/2021/05/31/automatic-building-detection-with-ohsome2label-and-tensorflow/) a [walkthrough](https://github.com/GIScience/ohsome2label/blob/master/walkthrough/README.md) on how to train your own building detectors using ohsome2label and the TensorFlow Object Detection API."
14300,"WN568","Programming","HeiGIT and the GIScience group at Heidelberg University are [releasing](http://k1z.blog.uni-heidelberg.de/2021/03/12/flood-impact-assessment-on-road-network-and-healthcare-access-at-the-example-of-jakarta-indonesia/) the [R code](https://gitlab.gistools.geog.uni-heidelberg.de/giscience/big-data/ohsome/ohsome-api-analysis-examples/completeness_highway_healthsites_jakarta) underlying their intrinsic data quality analysis of the completeness of the road network and health sites in Jakarta. The analysis is based on OSM data."
14285,"WN568","Releases","HeiGIT and MapAction have [announced](http://k1z.blog.uni-heidelberg.de/2021/05/19/the-ohsome-quality-analyst-goes-public-on-github-with-new-release-030/) two updates to the ohsome quality analyst (OQT). The new [version 0.3.0](https://github.com/GIScience/ohsome-quality-analyst/releases/tag/0.3.0) includes new OSM layers and a brand new data quality report with indicators about completeness and last edits. With this release it is now much easier to use OQT from your command line to calculate the data completeness for regions you are interested in. Starting now, OQT will also be improved publicly via [GitHub](https://github.com/GIScience/ohsome-quality-analyst), thereby improving collaboration with other researchers."
14305,"WN568","Software","HeiGIT [presented](http://k1z.blog.uni-heidelberg.de/2021/05/04/ohsome-region-of-the-month-building-information-analysis/) another 'evolution-animation' dealing with the development of mapped buildings in Nairobi using the [ohsome API](https://docs.ohsome.org/ohsome-api/v1/), in their blog post series 'ohsome Region of the Month'. The blog post series provides information on potential applications of the ohsome API."
14403,"WN571","Humanitarian OSM","The research team at HeiGIT has [analysed](http://k1z.blog.uni-heidelberg.de/2021/06/28/osm-changeset-analysis-with-humstats-and-the-ohsome-framework/) mapping collaborations between humanitarian organisations and corporations using [Humanitarian OSM Stats](https://humstats.heigit.org/), which combines data from the [Tasking Manager](https://tasks.hotosm.org), hosted by the [Humanitarian OpenStreetMap Team](https://www.hotosm.org/), and [ohsome](https://heigit.org/big-spatial-data-analytics-en/ohsome/) OSM History Data Analytics Platform. The results show that Aviva mappers have added more than 297,800 buildings and 8,320 km of roads to OSM since 2015."
14407,"WN571","OSM research","The team at HeiGIT [has written](http://k1z.blog.uni-heidelberg.de/2021/05/31/automatic-building-detection-with-ohsome2label-and-tensorflow/) a walkthrough on how to train your own building detector using [ohsome2label](https://github.com/GIScience/ohsome2label) and the [TensorFlow Object Detection API](https://github.com/tensorflow/models/tree/master/research/object_detection). You can [find](https://github.com/GIScience/ohsome2label/blob/master/walkthrough/README.md) all the necessary scripts and detailed walkthrough tutorials in the GitHub repo."
14416,"WN571","OSM research","The team at HeiGIT has [published](http://k1z.blog.uni-heidelberg.de/2021/06/24/ohsome-region-of-the-month-which-country-has-the-longest-coastline/) a tutorial on how to analyse which country has the longest coastline, using OSM data. They used the [ohsome](https://heigit.org/big-spatial-data-analytics-en/ohsome/) platform, which makes OpenStreetMap’s full-history data more easily accessible for various kinds of OSM data analytics tasks."
14985,"WN588","Maps","The [HeiGIT ohsome team](https://heigit.org/big-spatial-data-analytics-en/ohsome/) is [extracting](http://k1z.blog.uni-heidelberg.de/2021/10/22/2021-volcanic-eruption-in-la-palma-spain-continues-explore-the-temporal-changes-of-the-lava-field-in-openstreetmap-on-ohsomehex/) full history OSM data of the volcanic eruption on La Palma (Spain) and its constantly growing lava field to help keep OSM up to date. Temporally explore the data, including every single map edit, [here](https://ohsome.org/apps/osm-history-explorer/#/volcano_eruption_la_palma_spain_202109/2021-10-21T06:01:12Z%2F2021-10-21T14:00:00Z/13/28.616173745603703/-17.89821350736635)."
15133,"WN592","Education","Videos of presentations by Heidelberg Institute for Geoinformation Technology (HeiGIT), given at the recent FOSS4G conference, [are now available](http://k1z.blog.uni-heidelberg.de/2021/11/14/foss4g-2021-videos-with-heigit-contributions-online-osm-data-quality-and-mapswipe/) online. Subjects include: an [OSM Confidence Index](https://www.youtube.com/watch?v=DWkISL4qbME) developed using the [ohsome.org](https://heigit.org/big-spatial-data-analytics-en/ohsome/) framework, and an introduction and update on [MapSwipe ](https://www.youtube.com/watch?v=DIrPPKUS2_k)."
15173,"WN593","Software","Sarah Heidekorn [blogged](http://k1z.blog.uni-heidelberg.de/2021/11/24/how-to-become-ohsome-part-9-more-ways-to-access-the-ohsome-api/) about the new ways to access the [ohsome API](https://docs.ohsome.org/ohsome-api/v1/), an application that allows non-programmers to analyse the rich data source of OpenStreetMap history. Tools to help analyse OpenStreetMap data are available in packages for [Python](https://github.com/GIScience/ohsome-py), [R](https://github.com/GIScience/ohsome-r), [QGIS](https://github.com/GIScience/ohsome-qgis-plugin), and [JavaScript](https://gitlab.gistools.geog.uni-heidelberg.de/giscience/big-data/ohsome/libs/ohsome2x/-/blob/master/README.md)."
15403,"WN600","Did you know that…","... Sarah Heidekorn [wrote](http://k1z.blog.uni-heidelberg.de/2022/01/12/how-to-become-ohsome-part-11-counting-contributions/) part 11 of the ['How to become ohsome'-blog series](http://k1z.blog.uni-heidelberg.de/tag/become-ohsome/)? With the introduction of new contribution endpoints the user is now able to track the creation of, changes in the geometry or the tagging of, or deletion of objects in OpenStreetMap."
15520,"WN603","Events","[HeiGIT](https://heigit.org/), the Heidelberg Institute of Geoinformation Technology, [is presenting](http://k1z.blog.uni-heidelberg.de/2022/02/02/ohsome-quality-analyst-oqt-auf-der-fossgis-konferenz-am-090322/) ![(de)](https://weeklyosm.eu/wp-content/uploads/2022/01/de.svg) a lecture on 'ohsome quality analyst (OQT): assessing the quality of OpenStreetMap data' at the [FOSSGIS conference](https://pretalx.com/fossgis2022/talk/PVPUKC/) ![(de)](https://weeklyosm.eu/wp-content/uploads/2022/01/de.svg)  > [![en](https://weeklyosm.eu/wp-content/uploads/2020/09/en-green.svg)](https://pretalx-com.translate.goog/fossgis2022/talk/PVPUKC/?_x_tr_sl=auto&_x_tr_tl=en&_x_tr_hl=en&_x_tr_pto=wapp) on Wednesday 9 March from 16:30 to 16:50 CET."
